"Course Title","Credits","Subject code","Course Number","Academic Level","Course Description","General Education Labels","Requisites"
"Quantum Systems","-","PHYS","335","Undergraduate","Multi-electron atoms, statistical mechanics of classical and quantum systems and introduction to nuclear physics. Principles are applied to selected examples. 3 hrs. lec. Offered in fall. Prereq: PHYS 233, 334.","-","Yes"
"R&D in Graphic Communications and Packaging","-","AENG","455","Undergraduate","This course involves testing various components of the manufacturing processes involved in creating print and digital/web media. Typical activities will involve testing colorants (e.g., inks, toners, etc.) and substrates used in lithography, flexography, screen-printing and digital printing systems. Optimum conditions for specific printing methods will be determined through controlled testing and examination. Students may also propose to examine specific interrelationships between production procedures used in various digital media processes. The course will also cover color separation and reproduction, which includes the study of process color theory, desktop color separations and color reproduction. 2 hrs. lec., 3 hrs. lab. Prereq: ITEC 355 or permission of instructor.","-","Yes"
"Race and Ethnic Relations","-","SOCI","315","Undergraduate","Study of racial and ethnic relations, modes of adaptation of minorities and cross-cultural examinations of dominant-minority relations. Offered annually. Prereq: 3 s.h. of sociology or junior/senior status.","G3","Yes"
"Radar Meteorology","-","ESSC","449","Undergraduate","Algorithms used in the display and interpretation of weather radar data; theory of electromagnetic radiation, principles of radar operation, Doppler radar and interpretation techniques; wind velocity, rainfall rates and detection of individual cells, multiple cells and turbulence. 3 hrs. lec. Offered in spring of even years. Prereq: C- or higher in ESSC 241, MATH 311. Coreq or Prereq: ESSC 342.","-","Yes"
"Radio Production","-","COMM","320","Undergraduate","Theory and production of various types of audio production using basic studio equipment. Laboratory work required. Offered in fall, spring. Prereq: COMM 121.","-","Yes"
"Reading and Writing in the Content Areas","-","READ","622","Graduate","Discussion of strategies and techniques for enhancing comprehension, concept and vocabulary development, and writing skills in the content areas, specifically those reflected in the Structured Literacy Competences, grades 4-8. Offered winters","-","No"
"Reading Our World:","-","ENGL","242","Undergraduate","Applies critical lenses from fields of English Studies to a selection of texts on a particular theme. Engages students in interpreting current themes across cultures and/or time periods. Students will explore the topic from different perspectives by learning methods for critiquing texts, including new media. Themes/topics determined by instructor.","G1, Writing (W)","Yes"
"Reading/Writing for Civic Chng","-","WRIT","342","Undergraduate","An introduction to the theory and practice of public discourse, with emphasis on civic discourse. Focuses on exploring the nature and function of being a citizen within a community and developing discourse skills to effect change in communities. Prereq: ENGL 311 or 312 or 313 or 316 or 318 or 319.","Writing (W)","Yes"
"Real Analysis 1","-","MATH","464","Undergraduate","Rigorous development of the concepts and methods of calculus. The real number system and its topology; theory of limits and continuity; differentiable functions and their properties, the Reimann integral. Prereq: C- or higher in MATH 311 and MATH 345 or department permission.","-","Yes"
"Real Analysis 2","-","MATH","465","Undergraduate","Continuation of MATH 464. Topics chosen from the following: convergence and uniform convergence of infinite sequences and series of functions; topology of Euclidean n-space Rn; differential calculus of functions RnR and RnRm; extreme values; implicit and inverse function theorems;Riemann integration in Rn; metric spaces; function spaces; Riemann-Stieltjes integration. Offered infrequently. Prereq: C- or higher in MATH 464.","-","Yes"
"Real Estate Fundamentals","-","FIN","343","Undergraduate","Introduces special characteristics of real estate and how real estate decisions are made. Includes real estate terms, laws, commercial and residential markets, and property valuation. Offered periodically. Prereq: C- or higher in BUSN 341.","-","Yes"
"Realism and Naturalism to 1920","-","ENGL","424","Undergraduate","Studies stylistic, thematic and philosophic issues relating to literary realism and naturalism. Selections from writers including Twain, Howells, James, Crane, Norris, London and Dreiser. Prereq: ENGL 110, 237.","-","Yes"
"Realism and Naturalism to 1920","-","ENGL","624","Graduate","A study of stylistic, thematic and philosophic issues relating to literary realism and naturalism. Selections from writers such as Twain, Howells, Wharton, James, Crane, Norris, London and Dreiser. Offered periodically.","-","No"
"Realism in Child Literature","-","EDUC","634","Graduate","Examines the realistic treatments of topics in fiction and nonfiction for children and the issues that they raise. Censorship will be explored, and procedures for addressing it will be examined. Offered periodically.","-","No"
"Recent Developments in Psych","-","PSYC","505","Graduate","Contemporary issues in psychology examined through a critical review of current research, theory and practice. Designed to provide students with opportunities for independent study in areas where basic competencies are weak, or in areas of special interest. Offered periodically.","-","No"
"Reflective Practices","-","SPED","443","Undergraduate","This course prepares teacher candidates with the necessary skills to develop cultural sensitivity to work effectively with diverse families and their students with disabilities (mild/moderate disabilities). Teacher candidates explore culture and diversity as they apply to families, educators, and influences on daily activities, identity development, and systems of power and privilege in the educational system. Teacher candidates develop their ability to be culturally responsive, open, and respectful educators. Teacher candidates develop their professional dispositions consistent with family and student centered educational planning, program implementation and community collaboration centered on students with disabilities (mild/moderate; severe/multiple disabilities) and their diverse families.","Diversity (D), Writing (W)","Yes"
"Reimagining Holidays & Heroes","-","HIST","200","Undergraduate","Content-based inquiry into the celebration of US holidays and heroes. Course covers American Revolution and founding of the United States, Indigenous America since pre-Columbian interactions, and a history of Blacks in America from 1619 to the present.","G3","No"
"Relief Printmaking 1","-","ART","364","Undergraduate","Explores multiple approaches to creating relief prints. Starts at an introductory level technically and builds into an intermediate understanding and working knowledge of the process. Covers linocut, alternative relief matrices, color reduction and multiple block relief printing. Offered periodically. Prereq: ART 133, 142","-","Yes"
"Relief Printmaking 2","-","ART","464","Undergraduate","Builds on the information presented in Relief Print-making I. Starts at an intermediate level technically and builds with each process into an advanced understanding and working knowledge of the process. Covers linocut, woodcut, alternative relief matrices, color reduction, large format, mixed media, relief monoprinting, and multiple block relief printing. Students will be expected to develop a cohesive body of works from the projects and a personal investigation into artmaking. Offered periodically. Prereq: ART 364.","-","Yes"
"Remote Sensing & Image Interpretation","-","ESSC","380","Undergraduate","Principles of remote sensing; fundamentals of image visualization; radiative transfer equation; use of environmental, meteorological and oceano- graphic satellites; satellite algorithm and parameter estimation; use of Environment for Visualizing Images (EVSC) software for image analysis and interpretation. Basic computer literacy is assumed. 2 hrs. lec., 2 hrs. lab. Research project is required. Prereq: ESSC 221 or 241 or 261.","-","Yes"
"Renaiss Lit:","-","SPAN","582","Graduate","CR. Seminar in Renaissance Literature","-","No"
"Renaissance and Reformation","-","HIST","320","Undergraduate","Cultural, social and political history of Europe, 1300-1650, with emphasis on Renaissance arts and literature and 16th century religious upheaval. Offered periodically. Prereq: ENGL 110.","G3, Writing (W)","Yes"
"Renaissance in English","-","ENGL","604","Graduate","Renaissance spirit in England, demonstrated by nondramatic literature. Offered biennially.","-","No"
"Renaissance Literature","-","SPAN","482","Undergraduate","CR. Seminar in Renaissance Literature","-","No"
"Research and Development Technical Project","-","EDTE","698","Graduate","Design, execution and communication of applied research in technology education. Emphasis on recent technological advances and experimentation with contemporary processes, materials and techniques. Three types of applied research may be pursued: technical project, innovative instruction or technical research. Study is guided by a faculty adviser. Research and development results and applications are recorded as a research report.","-","Yes"
"Research and Evidence-Based Practice Methodology","-","NURS","502","Graduate","Advanced research in nursing builds on previous knowledge of research and statistics to develop an evidenced-based approach to practice. The learner will analyze methods and techniques of research and interpret their usefulness for application in practice. Theory and practice will be used in defining nursing problems and in development of a literature review. 3 hrs. theory. Prereq/Coreq: NURS 501","-","Yes"
"Research Design & Statistical Analysis","-","PSYC","612","Graduate","This course is designed to develop and extend skills in the interpretation of psychological research. Understanding the relationships between research methods, statistical procedures and interpretation is emphasized. Offered in fall and spring.","-","No"
"Research in Edu Ldshp Part 1","-","EDLD","890","Graduate","The purpose of the course is to help students identify potential dissertation topics in the field of education leadership such that when they pass their comprehensive examiniations they are prepared for dissertation seminar activities that support the development of their dissertation proposals. This course will bring together a group of students and faculty members periodically throughout the program to examine possible areas of research in the field of executive leadership in concert with the program themes of poverty and digital learning. Students will explore their ideas, background and potential methodologies with a collegial faculty and candidate group, address questions about the viability of possible research ideas and be introduced to a variety of sources that may help them refine their ideas or locate alternative areas of exploration based on their interests.","-","Yes"
"Research in Edu Ldshp Part 2","-","EDLD","891","Graduate","The purpose of the course is to help students identify potential dissertation topics in the field of education leadership such that when they pass their comprehensive examiniations they are prepared for dissertation seminar activities that support the development of their dissertation proposals. This course will bring together a group of students and faculty members periodically throughout the program to examine possible areas of research in the field of executive leadership in concert with the program themes of poverty and digital learning. Students will explore their ideas, background and potential methodologies with a collegial faculty and candidate group, address questions about the viability of possible research ideas and be introduced to a variety of sources that may help them refine their ideas or locate alternative areas of exploration based on their interests.","-","Yes"
"Research Methodology","-","SOWK","710","Graduate","-","-","No"
"Research Methods","-","EDFN","601","Graduate","Introduces methods of empirical educational research. Emphasis on training individuals to be intelligent consumers of educational research. It is strongly recommended that the course be taken early in the students program.","-","No"
"Research Methods","-","SOWK","525","Graduate","Introduces research concepts, procedures for conducting research and their application to social work practice. Advanced knowledge of scientific inquiry, the ethics that guide research and the roles of social workers as researchers are also covered. Both qualitative and quantitative methods of collecting and analyzing data are given major attention. Students learn the procedure for developing a research proposal.This course may be offered in multiple modalities.Prereq: SWK/SOWK 501","-","Yes"
"Research Methods in Psychology","-","PSYC","696","Graduate","Introduction to, and application of, advanced methods of psychological research. Emphasis placed upon the development and practice of research skills as preparation for conducting original research for a thesis.","-","Yes"
"Research Methods in Sport","-","WSSD","612","Graduate","Overview of the nature of research in sport sciences. Topics include different types of research methods in sport, research design, skills in data collection and assessment, and application of research to the management of sport.","-","No"
"Research Proposal","-","WSSD","698","Graduate","To fulfill the requirements of the course, students must satisfactorily complete an introduction, a review of literature and provide a written research design. APA format will be used for the research proposal. Offered as needed.","-","No"
"Research Report","-","ENGL","698","Graduate","Research Report","-","No"
"Research Report","-","SPAN","698","Graduate","-","-","No"
"Research Seminar in Special Education","-","SPED","689","Graduate","Acquaints graduate students with relevant areas of needed research in the field of special education. Attention is given to discovering relevant problem areas for investigation. Historical, descriptive and experimental methods of research are covered. The value of research based teaching practices is stressed. A main purpose is to guide the student through an experience of writing a grant proposal and a literature review. Prereq: EDFN 601","-","Yes"
"Resource Leadership","-","EDLD","852","Graduate","EDLD 852: Resource Leadership (3 credits) No pre or co requisites 
In this course, students will develop, monitor, evaluate, and manage data-informed and equitable district systems for operations, resources, technology, and human capital management. These aspects will be further examined through various leadership theories along with a focus to poverty and technology (in alignment with existing MU leadership foci). This course includes 60 required internship hours.
","-","Yes"
"Resp to Emergen: First Aid CPR","-","WSSD","311","Undergraduate","Preparation of students to develop skill and knowledge enabling them to administer first aid in the case of an accident or sudden illness. Certification in CPR and standard first aid according to American Red Cross standards.","-","No"
"Respiratory Assessment & Therapeutics","-","REST","413","Undergraduate","The lungs and chest wall are studied to gain an understanding of breathing mechanics in health and disease. Therapeutic measures are considered as to their value in reducing the work of breathing imposed by disease. Each student learns to examine the pulmonary patient and to integrate and evaluate the findings. Bronchopulmonary hygiene, chest physical therapy techniques and an overview of pulmonary rehabilitation are introduced and discussed. Prereq: REST 411, REST 412.","-","Yes"
"Respiratory Care in Alternate Sites","-","REST","419","Undergraduate","Alternate sites for respiratory care are studied to give the students a better understanding of the career opportunities within their reach. The students will understand their role as respiratory therapists in the home care, subacute care and pulmonary rehabilitation settings. Lecture, guest speakers, a camp experience, a one-day site visit and in-class presentations are included. Prereq: REST 413.","-","Yes"
"Respiratory Care Research","-","REST","495","Undergraduate","Each student selects, designs and conducts a research project, individually or with a research partner. The project culminates in a verbal presentation of the research and a manuscript from each student suitable for publication. Each project is assigned a faculty adviser to oversee and guide the research. Prereq: permission of program director.","-","Yes"
"Respiratory Care Techniques 1","-","REST","411","Undergraduate","A study of the basic techniques of respiratory care, including professional organizations, ethics, legal aspects, aerosol phamacology, lung hyper- inflation therapy and basic diagnostic appliances. Integrated lecture/lab. Prereq: BIOL 356 for the B.S. in biology; BIOL 254 and BIOL 255 for the B.S. in allied health technology.","-","Yes"
"Respiratory Care Techniques 2","-","REST","414","Undergraduate","The chest-imaging component prepares the student to evaluate chest X-ray films and to recognize and track the progression/resolution of abnormalities. CT scanning and MRI are given emphasis proportional to their utilization in chest medicine. Measurement and calculation of volume, flow rate, and ratios, and their physiologic significance, and testing procedures for performing various pulmonary function studies are included. Prereq: REST 411.","-","Yes"
"Respiratory Care Techniques 3","-","REST","417","Undergraduate","The course provides an overview of cardiovascular physiology, management of invasive monitoring catheters, calculation of all commonly used mechanics, and interpretation of data in pathologic states. Also, each student researches, prepares a journal-quality paper and presents a 40-50- minute verbal presentation on a selected pulmonary disease condition. Prereq: ENGL 110, REST 414.","Writing (W)","Yes"
"Retail Marketing","-","MKTG","336","Undergraduate","The role of retail institutions in the marketing system. Emphasis on strategy development in the retailing context. Offered infrequently. Prereq: C- or higher in BUSN 231.","-","Yes"
"Rhetorical Analysis","-","WRIT","340","Undergraduate","Analyze the rhetorical strategies of public writing, argument, and textual production. Students will apply theories of rhetoric and use rhetorical analysis to investigate genres of writing.","G1, Writing (W)","No"
"Rhetorics of Marginalized Communities","-","WRIT","343","Undergraduate","Explores the rhetorical practices of marginalized communities – may focus on women, African American speakers, LGBTQ+ groups, non-western rhetorics, counter-cultural groups, or other communities. The course focuses on how communities use rhetorical practices to effect social change in written, oral, and digital media, and connects earlier rhetorical traditions to contemporary examples. This course includes discussion, collaboration, essay writing, and the development of a final project. Prereq: ENGL 110","Writing (W), G1, Diversity (D)","Yes"
"Risk and Insurance","-","FIN","347","Undergraduate","Introduces principles and mechanics of insurance. Includes the conceptual and historical framework of insurance and the actual mechanics of insurance risk management as they pertain to personal and business needs. Offered periodically. Prereq: C- or higher in BUSN 341.","-","Yes"
"Robotics and Computer Vision","-","CMSC","456","Undergraduate","Intelligent robotic systems that deal with the physical world through visual, acoustic or tactile sensing. Fundamentals of robot vision, including image acquisition and camera geometry, pattern recognition, representation and analysis of shape, pixel neighborhoods, connectivity, distance measures, arithmetic operations on pixels and images, computations of area, centroid, moments, axis of least inertia, correlation techniques, histogram computation, manipulation of robot end effectors, robot task coordination and simple Cartesian robot manipulation. Offered periodically. C- or higher in CMSC 362.","-","Yes"
"Role Development and Theoretical Foundations of Advanced Practice","-","NURS","501","Graduate","Serves as the introductory course for the Master's of Science in Nursing degree. It is designed to provide a foundation to advance practice nursing. In this course, students will explore nursing concepts and theory. Emphasis is placed on bridging the theory-practice gap. Students will apply this theoretical basis in exploring advanced practice role development. Advanced practice core competencies will be introduced and analyzed.","-","No"
"Romantic Literature","-","ENGL","411","Undergraduate","Rise of romanticism in later 18th century to the beginning of Victorianism. Emphasis on poetry and criticism between 1798 and 1832. Prereq: ENGL 110, 237.","-","Yes"
"Romantic Movement in England","-","ENGL","611","Graduate","Main currents in the literature of the Romantic Age. Emphasis on Wordsworth, Coleridge, Byron, Shelley and Keats. Attention paid to Burns, Blake and major prose writers of the period. Offered periodically.","-","No"
"Safety and Hygiene Management","-","OSEH","410","Undergraduate","Principles and practices of occupational safety and environmental health management. Includes the development of safety objectives and policy, evaluation and management of risk, and program implementation and evaluation. Offered annually. Prereq: OSEH 220 and 320 or permission of instructor.","-","Yes"
"Safety Engineering Principles","-","OSEH","320","Undergraduate","Methods for the identification and analysis of industrial hazards. Emphasis on application of basic safety engineering principles for the control of losses in an industrial environment. Prereq: OSEH 120.","-","Yes"
"Sales Force Administration","-","MKTG","337","Undergraduate","Planning, direction and control of the sales force. Includes recruiting, selecting, training, supervising, compensating, motivating and evaluating sales representatives. Emphasis on acquisition of basic sales and managerial skills. Offered annually. Prereq: C- or higher in BUSN 231.","-","Yes"
"Satellite Meteorology","-","ESSC","347","Undergraduate","Orbital and radiative transfer physics applied to satellite meteorology systems. Contemporary applications of satellite remote sensing of the atmosphere, including the retrieval of cloud microphysics and precipitation, the generation of atmospheric vertical profiles of temperature and moisture, the retrieval of wind, and image interpretation in the context of weather forecasting. 3 hrs. lec. Offered in fall of even years. Prereq: ESSC 241; MATH 161 or MATH 163.","-","Yes"
"Scenic Painting","-","ENTC","320","Undergraduate","The study, exploration and practice of the materials and techniques of applying finishes, textures, decorative painting, and faux finishes as used in theatre, motion pictures, media, productions and architectural applications. Previous art experience is not required","-","Yes"
"Scholarly Evidence-Based Practice Evaluation and Dissemination","-","NURS","711","Graduate","Focus is on the evaluation and completion of the student’s scholarly project, including statistical analysis of the specified outcome measures. Analysis and application of the findings in the context of the greater healthcare system is essential. Emphasis on dissemination of results and sustainability of project.  Taught via independent instruction with the assigned project advisor.  ","-","Yes"
"Scholarly Project Design and Implementation","-","NURS","709","Graduate","Focus is on the design, defense, and implementation of the student’s scholarly project.  Integration of foundational courses to develop, design and successfully defend the proposed scholarly project.  Students also engage in implementation of the scholarly project, as well as collection of specified outcome measures. Students will engage in their select area of practice to enact the previously approved scholarly project.  Taught via independent instruction with the assigned project advisor. ","-","Yes"
"Scholarly Project Design Seminar","-","NURS","707","Graduate","Focus is on the design and defense of the student's proposed capstone project. Integration of foundational courses to develop, design and successful defend the proposed capstone project. Seminar style allows for increased interaction with faculty advisors and course peers. 3 cr; 1 cr lecture 2 cr (110 hours) clinical.","-","No"
"School Community Relations","-","EDLD","614","Graduate","Examination of the political, social and economic factors which influence the school's relationship with various community agencies and constituencies. Developing administrative sensitivity to community needs and effective articulation of the schools programs to the various communities. Offered annually.","-","No"
"School Counseling Practicum","-","SCCO","665","Graduate","Supervised field experience which familiarizes students with the practice of professional school counseling. Students will gain exposure to children at a variety of developmental levels, and will be required to log a minimum of 100 hours of direct experiences in a school counseling setting. Offered in fall or spring.","-","Yes"
