"Course Title","Credits","Subject code","Course Number","Academic Level","Course Description","General Education Labels","Requisites"
"Intercultural Comm in Contexts","-","COMM","625","Graduate","This course is designed to introduce major theories and research dealing with communication between people of different cultural backgrounds in crisis, emergency, risk, and disaster communication contexts. It examines theoretical issues and methodological concerns in studying intercultural conflicts, problem situations, and emergency management strategies. By examining the intersections of global and local in emergent and conflict situations, students will discover and investigate questions about intercultural communication phenomena, engaging with discussions of identity, culture, context, power, history, and relationships. Students will learn a range of research tools to conduct their independent research, sharing insights and participating in intercultural dialogues, with the goal of facilitating intercultural understanding and advocating for best practices during emergency management situations.","-","No"
"Intercultural Communication","-","COMM","317","Undergraduate","Explores the possibilities of communication between and among diverse cultures. Close study of cultural codes, symbolic interaction, nonverbal behavior and contexts of intercultural contact. Develops an understanding and appreciation of human diversity and competence in intercultural communication practices. Offered periodically. Prereq: COMM 100, ENGL 110 and junior standing.","Perspectives (P), Diversity (D)","Yes"
"Interm Photography:  Darkroom","-","ART","406","Undergraduate","Intermediate photography course with an emphasis on fine art, self-expression and creating a body of work, including color techniques, black and white techniques, studio lighting techniques, making enlargements, presenting prints for display. Covers criticism, history and analysis. Students must have a 35mm single-lens reflex film camera with fully manual focusing/exposure capabilities. Offered fall, spring. Prereq: ART 306 or permission of instructor.","-","Yes"
"Interm Photography:Digital","-","ART","410","Undergraduate","Digital course with a focus on fine art, including operation of camera, using Adobe Photoshop software, editing images, outputting images, making prints and matting prints for display. Covers criticism, history and analysis. Students should have a digital single-lens reflex camera. Loan cameras are also available. Offered spring. Prereq: ART 142, 306.","-","Yes"
"Intermediate Accounting 1","-","ACCT","361","Undergraduate","Financial statement preparation with special attention to revenue recognition and asset valuation. Emphasis on generally accepted accounting principles and accounting theory. Students will develop a familiarity with the official pronouncements. Offered in fall, spring. Prereq: C- or higher in BUSN 162.","-","Yes"
"Intermediate Accounting 2","-","ACCT","362","Undergraduate","Examination of generally accepted accounting principles as they apply to long term liabilities and equity. This course is a continuation of Intermediate Accounting I. Includes issues of current interest. Selected readings from pronouncements. Offered in fall, spring. Prereq: C- or higher in BUSN 341 and ACCT 361.","-","Yes"
"Intermediate Japanese 1","-","JAPN","201","Undergraduate","Continuation of JAPN 102. Further development of syntactical and phonological structures. Thematic basis for oral and written communication. Builds on proficiency attained in 101-102 sequence. Prereq: JAPN 102.","G1","Yes"
"Intermediate Japanese 2","-","JAPN","202","Undergraduate","Continuation of JAPN 201. Further development of syntactical and phonological structures. Thematic basis for oral and written communication. Builds on proficiency attained in JAPN 201. Prereq: JAPN 201.","G1","Yes"
"Intermediate Macroeconomics","-","ECON","319","Undergraduate","Similar in scope to 101, with major emphasis on the determination of the economy's total output, the price level and the level of employment. The course incorporates the interaction of the market for goods and services, the assets market and the labor market. Offered in fall. Prereq: ECON 101.","G3","Yes"
"Intermediate Microeconomics","-","ECON","318","Undergraduate","Similar in scope to ECON 102 with major emphasis on the further development and refinement of tools of economic analysis. Offered in spring. Prereq: ECON 101, 102.","G3","Yes"
"Intermediate Physics Lab 1","-","PHYS","351","Undergraduate","Selected Experiments in classical and modern physics introducing a variety of experimental techniques. 3 hours lab. Prereq: PHYS 232 and either PHYS 266 or CMSC 370. Offered in fall.","-","Yes"
"Intermediate Physics Lab 2","-","PHYS","352","Undergraduate","Continuation of PHYS 351. 3 hrs. lab. Offered in spring. Prereq: PHYS 351.","-","Yes"
"Intermediate Spanish 1","-","SPAN","201","Undergraduate","Emphasis is placed on further developing receptive and productive skills through varied realistic exercises and in authentic real-life situations. Contemporary cultural and literary texts provide the thematic basis for oral and written communication. Systematic treatment of grammar. Prereq: SPAN 102 or placement exam.","Diversity (D), G1","Yes"
"Intermediate Spanish 2","-","SPAN","202","Undergraduate","Continuation of SPAN 201. Communication in speech and writing; grammar and vocabulary are studied in greater depth and breadth. Increased emphasis on developing a cross-cultural perspective. Treatment of grammar and reading comprehension. Prereq: SPAN 201 or placement exam.","Diversity (D), G1","Yes"
"International Broadcasting","-","COMM","230","Undergraduate","Devoted to the cross-cultural study of the World Broadcasting Systems as an introduction to international electronic media. The course compares the ways in which the media are organized in other countries with that of the United States of America. Offered periodically. Prereq: ENGL 110; COMM majors; INTL majors, minors; or permission of instructor.","Writing (W)","Yes"
"International Economics","-","ECON","325","Undergraduate","Theory of international trade, commercial policy and trade in relation to economic development, balance of payments and the foreign exchange market, international monetary developments, foreign aid and economic growth. Offered in spring. Prereq: ECON 101, 102.","G3","Yes"
"International Finance","-","FINA","344","Undergraduate","The international financial environment and a comprehensive analysis of foreign exchange rates and instruments. Topics include the international monetary system, balance of payments, contemporary currency trading and quotation, forward contracts, international parity conditions and foreign currency options. Offered annually. Prereq: C- or higher in BUSN 341.","-","Yes"
"International Law","-","GOVT","351","Undergraduate","Classical sources and recent developments in international law. Evaluation of law in the context of world politics. Recommended: GOVT 251.","-","No"
"International Management","-","MGMT","357","Undergraduate","Examination of management challenges associated with developing strategies and managing operations of firms whose activities extend across national boundaries. Theoretical, institutional, and case analysis of major issues, including the impact of international codes and organizations on corporate policies, the effect of government policies, techniques for assessing foreign environments, and strategies for managing international business operations are covered. Prereq: C- or higher in BUSN 251.","G3","Yes"
"International Marketing","-","MKTG","435","Undergraduate","The development of marketing strategy for entering and competing with businesses in foreign countries. Uniqueness of foreign markets and their impact on the marketing manager's decision-making processes are examined. Offered annually. Prereq: C- or higher in BUSN 231.","-","Yes"
"International Music and Arts","-","MUSI","368","Undergraduate","Introduction to terminology and cultural areas of the world. General introduction to the study of world music, the ethnomusicological approach and classification and symbolism of musical instruments. The process of musical innovation and acculturation in the world, and the impact of technology and the communications media on contemporary musical styles of non-European cultures. Topics include the music of South and West Africa, Ethiopia and folk music of the Arabic. Near East, the classical music of Iran and Asia, and the musical cultures of North and South India. Offered in spring. Prereq: COMM 100, ENGL 110 and junior status. Offered periodically.","Diversity (D), G1, Writing (W)","Yes"
"International Music Business","-","MUSI","397","Undergraduate","Will delve into the cultural, technological and financial components of the international music industry. We will explore and analyze global trends, revenue streams, ethics and legal policy, marketing strategies, music consumption and distribution patterns, analytics/metrics, popular musical genres and the future of the music business in the United States, Canada, Europe, United Kingdom, Asia, Australia and Latin America.","-","Yes"
"International Organizations","-","GOVT","352","Undergraduate","Study of various intergovernmental and nongovernmental associations representing a number of multinational groupings serving humanitarian, economic and security functions. Emphasis on organizations such as the United Nations and the European Union. Recommended: GOVT 251.","G3","No"
"International Sport Management","-","WSSD","360","Undergraduate","Students will be introduced to a wide range of issues concerning international sport management, such as globalized sport industry, emerging trends in international sport, governance in international sport, international sport business strategies, and frontiers in international sport management. They will examine specific issues, challenges, as well as opportunities within the domain of international sport management. The course will cover many professional sporting events in every continents and regions of the world regarding their backgrounds, the participants in terms of athletes and spectators, the governance and management of the events , and the economic impacts.","Diversity (D)","No"
"Internship","-","OSEH","440","Undergraduate","Students work full-time for nine weeks or more under the direct supervision of an OSEH professional in industry, insurance, government agencies or other approved location. University supervision, seminars and evaluation are provided. Students experience problems, practices and principles in the management of occupational safety and/or industrial hygiene programs. To be taken twice, concurrently or consecutively, with increased work and research responsibilities. Prereq: senior OSEH majors and permission of OSEH coordinator.","-","Yes"
"Internship 1: School Counseling","-","SCCO","675","Graduate","Guidance and counseling experiences in the school setting (420 hours): individual supervision and seminar sessions. Prereq: SCCO 674 and permission. Offered in spring.","-","Yes"
"Internship 2: School Counselng","-","SCCO","676","Graduate","Counseling experiences in school and/or a community agency (300 hours) for students who are considering pursuing licensure as a Licensed Professional Counselor (LPC): individual supervision and seminar sessions. Prereq: SCCO 674 and permission. Offered in spring.","-","Yes"
"Internship and Seminar in School Psychology","-","PSYC","686","Graduate","Yearlong, extensive supervised clinical and field experiences in all domains of school psychology. Students meet regularly with University supervisor both individually and in seminars. Schedule in last year of program. Offered annually. Pre-requisites: All other M.S., Psychology, School coursework and Ed.S. coursework must be completed before internship. Professional liability insurance required. Updated clearances (ACT 34/ACT114/ACT151 and TB test results), which must be valid for the entire semester, must be on record with Field Services by the deadline. Follow the submission procedure and deadlines outlined by Field Services or you will be dropped from the class.","-","Yes"
"Internship for Athletic Coaching","-","WSSD","619","Graduate","Practical experience related to athletic coaching. Students will coordinate their coursework with specific field experience. Program supervised by a member of the Department of Wellness and Sport Sciences. Students must contact the graduate coordinator of sport management one semester prior to enrolling to complete the Internship Application packet. Prereq: WSSD 601, 602, 603, 604 and 605.","-","Yes"
"Internship for Athletic Management","-","WSSD","616","Graduate","Practical experience related to athletic management. Students will coordinate their course work with specific field experience. Program supervised by a member of the Department of Wellness and Sport Sciences. Students must contact the graduate coordinator of sport management one semester prior to enrolling to complete the Internship Application packet. Prereq: WSSD 601, 602, 603, 604 and 605","-","Yes"
"Internship in Elementary Education","-","ELED","678","Graduate","Internship in schools or educational situations under supervision of the graduate faculty of the Department of Elementary and Early Childhood Education. Offered periodically.","-","No"
"Internship in English","-","ENGL","500","Graduate","Co-Op Ed Experience in English","-","No"
"Internship in Wmn, Gndr, Sexlt","-","GNDW","300","Undergraduate","Co-Op Ed Experience in Wstu","-","No"
"Internship in Wmn, Gndr, Sexlt","-","GNDW","500","Graduate","Co-Op Ed Experience in Wstu","-","No"
"Internship in Wmn, Gndr, Sexlt","-","GNDW","400","Undergraduate","Co-Op Ed Experience in Wstu","-","No"
"Internship/Co-op in Design","-","DESN","300","Undergraduate","Internship/Co-Op experience in Design","-","No"
"Internship: Higher Ed & Comm","-","SCCO","641","Graduate","Field experiences for students interested in higher education and community agencies (300 hours) and/or for students who are considering pursuing licensure as a Licensed Professional Counselor (LPC): individual supervision and seminar sessions. This course does not serve as a substitute for SCCO 675. Prereq: SCCO 674 and permission. Offered in spring.","-","Yes"
"Interpersonal Communication","-","COMM","217","Undergraduate","Combines theory and experiential application of interpersonal communication in face-to-face and digital contexts. Provide students with a means to analyze interpersonal relationships and skills to integrate more effective communication strategies in their lives both online and offline. Offered periodically. Prereq: COMM 100.","G1","Yes"
"Interpretive Strategies","-","LACL","502","Graduate","Students will develop advanced critical and analytical skills to be applied to texts of different genres and cultures in the target language of study. The course is taught in English, but examples and some parts of the coursework will be dedicated to French, German, and Spanish, the languages of the Languages and Cultures program.","-","No"
"Intervention Research","-","SOWK","725","Graduate","Advanced research course introduces students to the five steps of intervention development, testing, and dissemination. Students will be given the opportunity to practice elements of these stages to master the strategies of implementing, documenting, and evaluating interventions that respond to social problems affecting systems of all sizes (e.g., individual, family, group, community).","-","No"
"Intl. Sport Issues & Industry","-","WSSD","410","Undergraduate","The purposes of this course are to introduce students to global sport-related issues and industries and to obtain firsthand experience in international sport events or organizations through a study abroad opportunity.","Perspectives (P)","No"
"Intro Learn Beh Analysis","-","PSYC","216","Undergraduate","This course provides an introduction to the field of Behavior Analysis, and covers the basic principles of conditioning, learning, and behavior change derived from the experimental literature. Topics include an introduction to the philosophy of Radical Behaviorism, historical development of the field, single-subject experimental design and data analysis, and principles of respondent and operant conditioning. Prereq: PSYC 100","-","Yes"
"Intro Photography:  Darkroom","-","ART","306","Undergraduate","Beginning black and white darkroom course with an emphasis on fine art, including operation of camera, developing film, making enlargements and mounting prints for display. Covers criticism, history and analysis. Students must have a 35mm single-lens reflex film camera with fully manual focusing/exposure capabilities. Offered in fall, spring.","G1","No"
"Intro Sequence/Motion/Vis Comm","-","DESN","246","Undergraduate","A study of narrative structures and spatial compositions as they relate to time and sequence. Students will be introduced to the principles of time- based design, with an emphasis on research, critical analysis and concept development. Various production methods such as storyboarding and scoring will be introduced. Offered periodically. Prereq: DESN 144 (or ART 144) or permission of instructor.","-","Yes"
"Intro Studio Art:","-","ART","584","Graduate","Fine Art intro level studio topics course designed for the Post Baccalaureate or Graduate Student. Topics will vary each semester.","-","No"
"Intro Studio Art:","-","ART","585","Graduate","Fine Art intro level studio topics course designed for the Post Baccalaureate or Graduate Student. Topics will vary each semester.","-","No"
"Intro to African American Studies","-","AFAM","201","Undergraduate","Provides an overview of African-American culture and history. African-American perspectives and contributions in the areas of literature, art, theater, music, politics, economics, science and technology, medicine, male-female relationships, family, the church and the media will be presented. Offered annually.","G3, Diversity (D)","No"
"Intro to Computers in Design","-","DESN","346","Undergraduate","Explores and develops design capabilities for graphic expression through the use of contemporary digital media. Offered periodically. Prereq: ART 133 or ART 242.","-","Yes"
"Intro to Data Analytics","-","MATH","255","Undergraduate","Introduction to data analysis techniques and programming that enables real-time decision making in IT organizations. Includes skills and applications in pre-processing, preparing, and reporting data for further analysis. (Cross-listed with ITAN 255, credit may not be received for both courses.)","-","Yes"
"Intro to Entrepreneurship","-","ENTR","501","Graduate","This course offers a broad overview of the art, science, and process entrepreneurship. Course concepts addressed include Corporate, Social, and Educational Entrepreneurism. Students will investigate opportunities for developing a business while learning how to evaluate opportunities, assess overall resources, and manage growth.","-","No"
"Intro to Environmental Science","-","GEOG","130","Undergraduate","Introduction to the scientific concepts, principles, and methodologies that underlie environmental change and environmental sustainability. Emphasis on the spatial scale and interconnection of multiple environmental processes, the effects of human activities on environmental processes, and the technical and scientific methods for their assessment and analysis.","G2","No"
"Intro to Executive Leadership","-","EDLD","832","Graduate","Introductory study of the organization and administration of American public education for persons interested in pursuing a professional career in educational administration. Students will examine theories of leadership based on cooperation, empowerment and fucilitation of change. A basic understanding of educational leadership is developed through integration oftheory, knowledge and actual practice. Focusing on the multi-fuceted roles of school/district leaders, students will study the role of an executive leader through the lens of the executive leader as a learner, mentor, instructional leader, supervisor, manager, politician, advocate and innovator. Combining theory with practice, students will obtain a deeper understanding ofthe complexity ofleadership within traditional and non-traditional school and district settings, including but not limited to urban and multilingual schools and/or blended and online learning environments.","-","No"
"Intro to Financial Accounting","-","BUSN","161","Undergraduate","Examination of the account cycle and systems and procedures for developing financial information; introduction to the conceptual and theoretical foundation of financial information systems; and interpretation of financial statements. Offered in fall, spring. Prereq: MATH 101 or MATH placement beyond MATH 101 (MATH 151, 155H, 160, 161, 163H).","-","Yes"
"Intro to Industrial Training","-","AENG","392","Undergraduate","Techniques and procedures required to conceptualize, prepare, deliver and evaluate training programs. Includes experiences in preparing instructional media, presenting a unit of instruction and developing appropriate evaluation instruments. Prereq: ENGL 110.","Writing (W)","Yes"
"Intro to International Studies","-","INTL","201","Undergraduate","Study of global cultural diversity, economic interdependence, environmental issues and international relations. Offered in fall, spring.","G3","No"
"Intro to Internationl Business","-","INTB","321A","Undergraduate","A survey of international business (IB). Introduces major issues, institutions, opportunities, problems and managerial processes unique to international business. Includes micro and macro context, theory, impact of environmental factors on international business operations, and identification and analysis of managerial issues. Course content relates to current events. Offered in fall, spring. Prereq: ECON 101, 102.","G3","Yes"
"Intro to Internationl Business","-","INTB","321B","Undergraduate","A survey of international business (IB). Introduces major issues, institutions, opportunities, problems and managerial processes unique to international business. Includes micro and macro context, theory, impact of environmental factors on international business operations, and identification and analysis of managerial issues. Course content relates to current events. Offered in fall, spring. Prereq: ECON 101, 102.","G3","Yes"
"Intro to Linguistic Analysis","-","ENGL","221","Undergraduate","Studies the structure, function, and meaning of language in use from social and corpus-based approaches. Prereq: ENGL 110.","G1","Yes"
"Intro to Managerial Accounting","-","BUSN","162","Undergraduate","Problem-oriented introduction to the interpretation and application of accounting information from the viewpoint of management with emphasis on planning and control and long-range strategies. Offered in fall, spring. Prereq: C- or higher in BUSN 161.","-","Yes"
"Intro to Mathematical Proof","-","MATH","310","Undergraduate","Emphasizes mathematical reasoning and communication of mathematical ideas both orally and in writing. Symbolic logic. Techniques of mathematical proof. Algebra of sets, binary relations and functions. Infinite sets, both countable and uncountable. Prereq: ENGL 110 and C- or higher in MATH 211.","Writing (W)","Yes"
"Intro to Media Arts Production","-","COMM","121","Undergraduate","Audio and video production fundamentals, techniques and uses. Includes study of the production process and hands-on production assignments in both audio and video. Laboratory work required. Offered in fall, winter, spring.","-","No"
"Intro to Military Science 1","-","MLSC","101","Undergraduate","An introduction to the fundamental components of service as an officer in the United States Army. Initial lessons form the building blocks of progressive lessons in values, fitness, leadership and officership. By means of both written and oral presentations regarding the history of military art, battle history, technical studies and the relationship of the armed forces with society, students will be encouraged to develop a habit of critical reflection. In addition to developing a foundation of military officership and leadership, students will receive practical instruction in the application of military art and basic soldier skills. Meets one hour per week plus a weekly 90-minute leadership lab. MLSC 101 in fall and MLSC 102 in spring.","-","No"
"Intro to Military Science 2","-","MLSC","102","Undergraduate","An introduction to the fundamental components of service as an officer in the United States Army. Initial lessons form the building blocks of progressive lessons in values, fitness, leadership and officership. By means of both written and oral presentations regarding the history of military art, battle history, technical studies and the relationship of the armed forces with society, students will be encouraged to develop a habit of critical reflection. In addition to developing a foundation of military officership and leadership, students will receive practical instruction in the application of military art and basic soldier skills. Meets one hour per week plus a weekly 90-minute leadership lab. MLSC 101 in fall and MLSC 102 in spring.","-","No"
"Intro to Photo: Digital","-","ART","376","Undergraduate","Beginning digital course that introduces the basic skills and concepts associated with digital photography as used by contemporary visual artists and communicators. Covers cameras, computer hardware, photo-editing software, printing, file management, criticism, history and analysis. Students must have a digital single-lens reflex camera.","G1","No"
