"Course Title","Credits","Subject code","Course Number","Academic Level","Course Description","General Education Labels","Requisites"
"17th Cen Lit Prior Restoration","-","ENGL","406","Undergraduate","Metaphysical and cavalier poetry and other nondramatic literature from 1600 to 1660, exclusive of Miltons poetry. Prereq: ENGL 110, 237.","-","Yes"
"17th Century Anglo-America","-","HIST","490","Undergraduate","This perspectives course introduces students to the use of anthropological methods in studying past societies through examinations of small communities in England and America. Offered annually. Prereq: COMM 100, ENGL 110 and junior status.","Perspectives (P)","Yes"
"17th Century British America","-","HIST","351","Undergraduate","The founding and growth of the British Colonies to the Glorious Revolution of 1688, with particular attention devoted to society, beliefs and government. Offered annually. Prereq: ENGL 110.","G3, Writing (W)","Yes"
"18th Century Literature","-","SPAN","584","Graduate","CR. Seminar in Eighteenth- Century Literature","-","No"
"19th Century Literature","-","SPAN","585","Graduate","CR. Seminar in Nineteenth- Century Literature","-","No"
"19th Century Literature","-","SPAN","485","Undergraduate","CR. Seminar in Nineteenth- Century Literature","-","No"
"20th Century Literature","-","SPAN","586","Graduate","CR. Seminar in Twentieth- Century Literature","-","No"
"20th Century Literature","-","SPAN","486","Undergraduate","CR. Seminar in Twentieth- Century Literature","-","No"
"21st Century Math","-","MATH","622","Graduate","The intent of the course, Teaching Mathematics in The 21st Century, is to examine, study, and analyze teaching techniques and alternate approaches to teaching and learning mathematics in the 21st century. Students will experiment with a variety of pedagogies that are more in-line with the way in which 21st century students live rather than how they are often taught. Comparisons of multiple pedagogies (current, past and potential future) will be frequently made and discussed.","-","No"
"2D Design","-","ART","142","Undergraduate","Introduces two-dimensional design and composition, applicable to all art forms, in which students seek original, creative solutions to problems. Design principles and methods are employed as students learn language and visual communications techniques. Artistic production, criticism, analysis and evaluation are central to this course. For both non-art and art majors. Offered in fall, spring.","G1","No"
"3D Design","-","ART","242","Undergraduate","Introduces visual composition as related to organizing and working with three-dimensional space. The student seeks original, creative solutions to visual problems by exploring methods and techniques. Covers fundamental visual grammar and principles. Offered in fall, spring. Prereq: ART 142.","-","Yes"
"3D Digital Design","-","ART","243","Undergraduate","Introduces visual composition related to organizing and working with digital three-dimensional space and digital fabrication. The student seeks original, creative solutions to visual problems by exploring methods and techniques. Covers fundamental visual grammar and principles.  Offered in summer. ","-","No"
"7-12 Assessment","-","MATH","618","Graduate","Course for secondary mathematics teachers who wish to explore the nature of the mathematics assessment from a variety of perspectives. The course will examine traditional and non-traditional forms to assessment as well as the purpose of formative and summative assessments - allowing for discussion of the pros and cons to each. The course will also examine the impact of assessment tools on individual classroom instruction as well as within local departments, schools, districts, states and national education issues. The course will seek to actively involve teachers in a productive dialogue about the mathematics that they teach and explore a variety of levels at which the mathematics can be assessed. In otder to do this, it will be necessary at times to expand and explore K-16 mathematics assessment at some length.","-","No"
"Abnormal Psychology","-","PSYC","337","Undergraduate","A comprehensive study of the etiology, characteristics and treatment in the categories of abnormal behavioral manifestation. Offered in fall, spring. Prereq: ENGL 110 and PSYC 100.","G3, Writing (W)","Yes"
"Abstract Algebra 1","-","MATH","345","Undergraduate","Groups, rings, fields, integral domains. Emphasis on structure of algebra. Prereq: C- or higher in MATH 310 and 322.","-","Yes"
"Abstract Algebra 2","-","MATH","445","Undergraduate","Continuation of MATH 345. Introduction to field theory, rings of polynomials, introduction to Galois theory. Offered periodically. Prereq: C- or higher in MATH 345.","-","Yes"
"Academic Assess & Intervention in MTSS","-","PSYC","672","Graduate","Prepare students to assist schools in the provision of appropriate academic programming for children within the context of current federal and state regulations. A multi-tiered system of academic service delivery will be used as a framework for developing appropriate assessments. Students will learn to conduct assessments that answer academic referral questions, inform intervention design, and measure intervention integrity and effectiveness. Ecological and direct assessments will be discussed in depth. Solution-focused report writing skills utilizing an RTI/MTSS approach will be introduced and developed. Offered annually.","-","No"
"Accomplished SPED Capstone","-","SPED","695","Graduate","This course enables the student to put theory into practice as it pertains to the professional contributions of an accomplished special education teacher. In accordance with the ongoing consultation of the instructor, the student will design, implement, and reflect upon a major capstone project aligned with the objectives of the program. Capstone examples include, but are not limited to (a.) action research, (b) creation/presentation of professional development, (c.) creation/presentation of original scholarship at a professional conference, (d.) mentorship of a pre-service or new special education teacher, (e.) grant writing. The course is 3 hours (pass/fail). However, if the student is unable to complete all requirements of the course during a single semester, they may re-enroll for 1 credit up to 2 additional, consecutive semesters for a total of 5 credits.This course requires both in-class instruction and out of class application. Regular access to a special education classroom is highly recommended. Pre-requisites: Completion of all SpEd MEd coursework. Up to 6 credits (not from the Knowledge Core) may be taken concurrently.","-","No"
"Accounting Information System","-","ACCT","363","Undergraduate","Special emphasis on current problems and issues using small business accounting software. Offered infrequently. Prereq: C- or higher in ACCT 361.","-","Yes"
"Acting 1","-","THEA","130","Undergraduate","Training in the art and craft of acting. Emphasis on developing basic skills and exploring the creative process. Elementary scene and monologue work. Offered in fall.","G1","No"
"Acting 2","-","THEA","230","Undergraduate","Further explores the purpose of acting and underlying principles, as well as training voice and body to project characterization. Offered biannually in spring. Prereq: THEA 130 or permission of instructor.","G1","Yes"
"Action Research","-","SPED","693","Graduate","In-depth approach to a specially and individually structured problem. Seminars to discuss recent trends and issues in special education will be included. Students may visit and become familiar with institutions, private schools and innovative public school classes for students with disabilities.","-","Yes"
"Actuarial Science Seminar","-","MATH","419","Undergraduate","A synthesis of calculus and probability that will develop the knowledge of the fundamental probability tools for quantitatively assessing risk. Students will be provided with the skills required in such examinations as the SOA Exam P and CAS Exam 1. Does not count as an upper-division elective for the mathematics major or minor. Offered in spring.","-","Yes"
"Acute Cardiopulmonary Care","-","REST","410","Undergraduate","This course is designed to give the student a complete understanding of artificial airways, manual artificial ventilation methods, and cardiopulmonary resuscitation. A basic study of cardiac physiology and electrocardiograph interpretation will be discussed. Integrated lecture/lab. Prereq: BIOL 356, for the B.S. in biology; BIOL 254 and BIOL 255 for the B.S. in allied health technology. Basic Life Support for Healthcare Providers, for both programs.","-","Yes"
"Addictions in Field of SOWK","-","SOWK","617","Graduate","This course will focus on the topic of addictions, preparing students to recognize and intervene when clients and their families demonstrate addictions problems in a wide range of social service agencies and host settings, such as child welfare, mental health, aging, schools, health care, corrections, and drug and alcohol programs. The course will examine the evolving models of alcohol and chemical dependency to the present day understanding of the disease model, including an examination of the neurobiology of addiction and basic pharmacology including medication assisted therapies. The concept of harm reduction is introduced. Using a case studies approach, students will develop assessment and intervention skills. The course will address professional issues including credentialing, confidentiality and ethics.","-","Yes"
"Adm and Suprv of Echd Prgrms","-","ECED","615","Graduate","The role of the early childhood program administrator as an educational leader. Topics include educational decision making; program development; effective staff supervisory skills; facility management; funding sources and procedures; advocacy; and health, safety and nutrition issues. Offered periodically.","-","No"
"Admin and Supervision of Sped","-","SPED","681","Graduate","Current issues and practices of special education curriculum and instruction, school law, budget process, staff development, teacher supervision, family collaboration and public relations are analyzed. Discussions are geared to effecting change to meet standards, student needs and best practices for students with special needs. Offered periodically.","-","Yes"
"Administration and Supervision","-","SOWK","608","Graduate","This course is designed to expand students knowledge of and skills in effective program management of human services organizations and to provide approaches for managing service programs effectively. Organizational and management theories and principles are applied to a range of human services. This course will provide students with an introduction to the knowledge and skills necessary to perform managerial and supervisory functions in public and private human service organizations, including those that have historically served populations at risk. It will examine the structure and processes of human service organizations, the process of management, and organization building. The course will also cover different supervisory approaches and techniques and consider supervisory challenges that arise in various practice settings. During this course, students will be provided with opportunities to build competencies.","-","Yes"
"Administrative Supervision","-","EDSU","701","Graduate","Administrative theory, budget development and school finance, certification, teachers and students rights and responsibilities, school law, tenure, collective bargaining. Offered annually.","-","No"
"Adult Health Concepts for Nursing Practice I","-","NURS","240","Undergraduate","Addresses safe nursing care and the needs of patients with cancer and other celluar alterations.    Transfer equivalency course only;  available only for students currently enrolled in or have completed the HACC RN ADN program. ","-","Yes"
"Adult Health Concepts for Nursing Practice II","-","NURS","241","Undergraduate","Addresses safe nursing care for patients with complex physiological needs.  Transfer equivalency course only;  available only for students currently enrolled in or have completed the HACC RN ADN program. ","-","Yes"
"Adv Lab in Developmental Science","-","PSYC","327","Undergraduate","Examines advanced topics in child and adolescent development in depth through the application of experimental and nonexperimental research approaches an through critical reading of the research literature. 3 hrs. lec., 2 hrs. lab. Offered annually. Prereq: C- or higher in PSYC 211, 212 and 227 or 228.Submission of satisfactory FBI, Act 34/151 clearances required prior to the start of the course, but not for registration.","-","Yes"
"Adv Lab Learn Beh Analysis","-","PSYC","316","Undergraduate","A theoretical laboratory course designed to investigate and apply the concepts of learning and motivation to both human and animal behavior. 3 hrs. lec., 2 hrs. lab. Offered annually. Prereq: C- or higher in PSYC 211, 212 and 216.","-","Yes"
"Adv Lab Sensation & Perception","-","PSYC","315","Undergraduate","A laboratory course designed to develop an understanding of the models and theories of the sensory and perceptual systems. 3 hrs. lec., 2 hrs. lab. Offered in fall, spring. Prereq: C- or higher in PSYC 211, 212 and 215.","-","Yes"
"Adv Manufacturing Systems","-","AENG","485","Undergraduate","Computer-integrated manufacturing (CIM) systems, strategies and implementation across the manufacturing enterprise. Focus on the integration of systems such as design of products; computer-aided engineering (CAE); the control of quality, design and construction of production tooling, rapid prototyping, computer-aided process planning (CAPP), finite element analysis (FEA), computer-aided design (CAD), computer-aided manufacturing (CAM) and computer numerical control (CNC). Manufacturing, automation and robotics emphasized. Advanced-level production experiences with an intensive research and development component required. 2 hrs. lec., 3 hrs. lab.","-","Yes"
"Adv Oral Practice and Self-Exp","-","SPAN","445","Undergraduate","CR. Advanced Oral Practice and Self- Expression","-","No"
"Adv Prob:","-","AENG","525","Graduate","Resources, processes and outcomes of selected technical areas in technology education. Technical area emphasized (e.g., computer-aided drafting and design, computer numerical control, desktop publishing, digital electronics, manufacturing, photography and robotics) varies with the course offering. Laboratory experiences focus on technological problem solving. 2 hrs. lec., 3 hrs. lab.","-","No"
"Adv Prob:","-","AENG","535","Graduate","Resources, processes and outcomes of selected technical areas in technology education. Technical area emphasized (e.g., computer-aided drafting and design, computer numerical control, desktop publishing, digital electronics, manufacturing, photography and robotics) varies with the course offering. Laboratory experiences focus on technological problem solving. 2 hrs. lec., 3 hrs. lab.","-","No"
"Adv Prob:","-","AENG","515","Graduate","Resources, processes and outcomes of selected technical areas in technology education. Technical area emphasized (e.g., computer-aided drafting and design, computer numerical control, desktop publishing, digital electronics, manufacturing, photography and robotics) varies with the course offering. Laboratory experiences focus on technological problem solving. 2 hrs. lec., 3 hrs. lab.","-","No"
"Adv Prod for Live Entertainmnt","-","ENTC","313","Undergraduate","An advanced study of entertainment rigging, power/data distribution, and specialty systems in entertainment technology. Students develop an understanding of higher-level creative solutions to production in entertainment. Students are expected to have a strong knowledge of entertainment technology and technical theatre. Prerequisites: THEA 120 Stagecraft and THEA/ENTC 220 Lighting & Sound.","-","Yes"
"Adv Radio Prod: Podcasting","-","COMM","422","Undergraduate","Provides students with a comprehensive background in all aspects of podcast production. Promotes critical thinking/listening skills and emphasizes advanced level storytelling mechanics. Analysis of best practices for distribution, marketing, monetization, and audience analytics. Lecture/lab course design. Offered periodically. Prereq: COMM 121","-","Yes"
"Adv Wthr Anlys/Forecstng Pract","-","ESSC","442","Undergraduate","Advanced synoptic and mesoscale weather analysis and forecasting skills. Students perform weather analysis exercises designed to complement the forecast process. Students prepare probabilistic meteorological forecasts and lead post-forecast discussions focused on lessons learned. 1 hr. lec., 2 hrs. lab. Offered in spring. Prereq: C- or higher in ESSC 441 and one semester of Campus Weather Service or by permission of instructor. Coreq: ESSC 444.","-","Yes"
"Adv. Lab Cognitive Psychology","-","PSYC","314","Undergraduate","A laboratory course designed to examine the nature of human memory, perception and thought, and to provide an introduction to the techniques used to study these phenomena. 3 hrs. lec., 2 hrs. lab. Offered annually. Prereq: C- or higher in PSYC 211, 212 and 215.","-","Yes"
"Advancd Fine Art Metal/Jewelry","-","ART","492","Undergraduate","Advanced study in jewelry and metals in which the student continues to develop style and techniques while discovering personal artistic direction. Covers techniques including surface embellishment, filigree, stonesetting, and mechanisms to be used as tools for aesthetic expresssion. Expands student awareness of historical and contemporary jewelry/metal work while incorporating concept with craft. Problem solving and critical analysis are emphasized in this course, along with professional practices and portfolio development. Offered in spring. Prereq: ART 391.","-","Yes"
"Advance Pedagogy in Special Education","-","SPED","654","Graduate","Familiarizes experienced educators with an in-depth examination of research based pedagogical methods used to improve academic, social, behavioral, and transitional outcomes for Pre K-12 students with disabilities. Current instructional and assistive technologies will be explored. Specific topics and strategies explored in course will be aligned to the strengths and preferences of each student. Selection, implementation, and assessment of appropriate teaching strategies with an authentic audience  or through case studies will be expected.  out of class application. Regular access to a special education classroom is highly recommended.","-","No"
"Advanced Accounting","-","ACCT","465","Undergraduate","Accounting formation, operation and liquidation of the partnership and corporate forms of business. Emphasis on preparing consolidated financial statements. Review of topics such as nonprofit accounting and multinational business. Offered annually. Prereq: ACCT 362.","-","Yes"
"Advanced Adolescent Psychology","-","PSYC","526","Graduate","Personal and environmental forces that are dynamic in the behavior of adolescents. Emphasis is given to the family, school and community aspects of adolescent behavior. Recent developments in adolescent psychology and adolescent development are emphasized. Offered annually.","-","No"
"Advanced Applications in Drafting and Design","-","AENG","446","Undergraduate","Focuses on advanced techniques, applications, and field-related career interactions in drafting, design, modeling, and rendering based on industry standards and advancements. Research, development, and presentation activities, plus completion of projects are required. 2 hrs. lecture, 3 hrs. lab. Prereq: AENG (ITEC) 342.","-","Yes"
"Advanced Behavioral Health Concepts for Nursing Practice ","-","NURS","244","Undergraduate","Addresses safe  nursing care of patients, families, and groups with complex behavioral health needs.  Transfer equivalency course only;  available only for students currently enrolled in or have completed the HACC RN ADN program. ","-","Yes"
"Advanced Child Psychology","-","PSYC","525","Graduate","In-depth examination of human development, with emphasis on birth through adolescence. Presentation of current accounts characterizing development in various domains (physical, cognitive, social, moral, psychosexual) and critical reviews of theoretical attempts to explain the process of development. Offered annually.","-","No"
"Advanced Clinical Knowledge","-","NURS","508","Graduate","Builds upon previous knowledge in physical assessment, pathophysiology, and pharmacology. Using a systems approach, examines principles of select well and disease states. Provides the opportunity to assess, analyze, and explore the findings, treatment, and evaluation of common health issues. Analyzes the relationships between assessment findings, physiologic changes, and pharmaceutical treatments.","-","No"
"Advanced Composition","-","WRIT","311","Undergraduate","Exploration, evaluation and writing across diverse and dynamic writing contexts to create rhetorically sophisticated texts, such as memoirs, socially expressive essays or other varieties of creative nonfiction; Classical and/or Rogerian arguments; ethnographic studies; varieties of public discourses; innovative, multigenre researched writing; summaries, abstracts and literature reviews; and texts designed for websites, wikis and blogs. Prereq: ENGL 110 or equivalent, 60 s.h.","Advanced Writing (AW)","Yes"
"Advanced Computer Art","-","ART","445","Undergraduate","Offered in fall and/or spring. Prereq: ART 345.","-","Yes"
"Advanced Computer Networking","-","ITAN","335","Undergraduate","This is an advanced-level course on computer networks. This course is the continuation discussion on ITAN 230 Network Concepts. The course has a comprehensive overview on advanced topics in network protocols, and networked systems. This course starts with a brief overview of TCP/IP protocol suite and reference model. The main discussions are fundamentals of network technology, Routing Algorithms, Routing Among the ISPs, Software Defined Networking (SDN), Network Management and SNMP, Error-Detection and Correction Techniques in Link Layer, Link-Layer Addressing and ARP, Virtual Local Area Networks (VLANs), Data Center Networking, Wireless and Mobile Networks, Mobility Management, and Security in Computer Networks. Some Network security topics are discussed such as: Principles of Cryptography, Digital Signatures, End-Point Authentication, Securing E-Mail, Transport Layer Security (TLS), Virtual Private Networks (VPNs), and Firewalls. Prerequisites: ITAN 230","-","Yes"
"Advanced Computers In Design","-","DESN","446","Undergraduate","Offered in fall and/or spring. Prereq: ART 346.","-","Yes"
"Advanced Curriculum in ECHD","-","ECED","614","Graduate","Extension of basic curriculum theory and practice as it applies to programs for young children. Sources of influence on early childhood curriculumsuch as professional organizations, learning theorists and historical practicewill be examined. Students analyze and revise or refine curriculum content and practices in their individual learning situations. Offered annually.","-","No"
"Advanced Curriculum, Instruction and Assessment: Engaging Young Learners","-","ECED","610","Graduate","This course is designed to prepare students in the areas of curriculum, instruction, and assessment young learners (i.e., PreK – 4th Grade). The course will focus on curricular philosophy and theory, approaches to early childhood education, pedagogical content knowledge, child development, and assessment of young learners. Current research, practice, and trends in early childhood education will be considered.","-","No"
"Advanced Educational Psychology","-","EDFN","545","Graduate","A review of psychological principles as they relate to human learning in the urban and non-urban setting. Special consideration is given to motivational and developmental factors in the school that influence students learning. Additional topics include examination of assessment and evaluation practices, classroom management and accommodating individual differences.","-","No"
"Advanced Electronics","-","PHYS","462","Undergraduate","Microprocessor applications and interfacing, real-time programming. Topics are selected from computer design, control loops, phase-locked loops and communications. Two 3-hr. labs. Offered infrequently. Prereq: PHYS 266, 365 or permission of instructor.","-","Yes"
"Advanced Field Practicum 1","-","SOWK","630","Graduate","Provides students with practical experience (250 hours) in supervised direct-service activities across all client systems, from the individuals level to that of the community. This advanced field experience allows students to apply theory and skills acquired in the generalist concentration areas while simultaneously fostering the development of a professionally reflective, ethical, knowledgeable and self-evaluating social worker. The course also includes a seminar where students discuss and process the field experience with faculty.Prereq: SWK/SOWK 531 or SWK/SOWK 601. Coreq: SOWK 620.","-","Yes"
"Advanced Field Practicum 2","-","SOWK","631","Graduate","Provides students with practical experience (250 hours) in supervised direct-service activities across all client systems, from the individuals level to that of the community. This advanced field experience allows students to apply theory and skills acquired in the generalist concentration areas while simultaneously fostering the development of a professionally reflective, ethical, knowledgeable and self-evaluating social worker. The course also includes a seminar where students discuss and process the field experience with faculty.Prereq: SWK/SOWK 531 or SWK/SOWK 601. Coreq: SOWK 620.","-","Yes"
