"Course Title","Credits","Subject code","Course Number","Academic Level","Course Description","General Education Labels","Requisites"
"Early American Literature","-","ENGL","421","Undergraduate","Examination of colonial and federal literature, with some discussion of the beginnings of Romanticism. Special attention to Bradstreet, Taylor, Edwards, Franklin, Wheatley, Brockden Brown, Irving and Cooper. Prereq: ENGL 110, 237.","-","Yes"
"Early British Literature: Dragons, Knights & Faerie Queens","-","ENGL","233","Undergraduate","Survey of British literature from Anglo-Saxon times to 1800. Texts studied span early tales like Beowulf and King Arthur legends through Shakespeare's plays up to the rise of the novel. Texts studied in context, including social problems and big questions about the nature of faith and heroism, love and life, the monstrous and magical. Readings selected to include works by women writers, writers of color, and writers speaking from the margins of British society.","G1","No"
"Early Childhood Education in Today's Society","-","ECED","511","Graduate","An overview of the field of early childhood education. Historical and philosophical influences on past and current approaches to teaching young children are traced and analyzed. The developmental needs and characteristics of the young child, with emphasis on the pre-primary level, are related to current curriculum programs and practices. Emphasis is placed on the necessity of using developmentally appropriate learning materials and teaching strategies.Topical study includes concepts, definitions, child developmental theories and skills needed by today's classroom professionals. In lieu of field experiences, appropriate teaching behavior is modeled by the instructor, and actual classroom occurrences are examined through Teacher Work Sample (TWS).","-","No"
"Early Inervention to Kindergarten","-","SPED","341","Undergraduate","This course examines the implications of federal mandates for providing educational and supportive services for infants/toddlers/preschoolers with disabilities and their families. The teacher candidates gain knowledge in interpreting data from formal and informal sources to be utilized in developing Individualized Family Service Plans (IFSP). The teacher candidates use case study and field experience data to recommend appropriate school-based programs for young children with disabilities. They also implement effective teaching strategies to meet the family, academic, social, emotional and behavioral needs of young children with disabilities in inclusionary environments. These strategies will be applied in field placements during the semester. Offered in spring. Prereq: EDFN 211, 241, ECPK 225 or EDUC 220; SPED 237; Act 34, 151, 114 clearances and admission to Advanced Professional Studies (APS). Coreq: ECPK 421, SPED 321.","-","Yes"
"Early Modern Europe, 1500-1789","-","HIST","505","Graduate","An intensive readings and discussion course focusing on the major issues and interpretations of early modern Europe. Offered every third semester.","-","No"
"Earth Materials","-","ESSC","327","Undergraduate","Identification, crystal chemistry, crystallography and occurrence of common minerals; optical theory and interaction of light with crystals; mineral and rock identification through use of transmitted polarized light; identification, formation, and occurrence of common rocks. 3 hrs. lec., 3 hrs. lab. Offered fall of odd years. Prereq: C- or higher in 221.","-","Yes"
"Earth Systems & Natural Hazards","-","ESSC","101","Undergraduate","The scientific understanding of Earth systems as the causes of natural disasters, such as earthquakes, volcanoes, landslides, hurricanes, tornadoes, floods and tsunamis. 3 hrs. lec. Does not count toward Meteorology major.","G2","No"
"EBPs for Math, Lit, Cntnt Area","-","SPED","463","Undergraduate","This seminar, taken in conjunction with Student Teaching, is for all teacher candidates in the PK-12 Special Education Certification program. This seminar provides teacher candidates the opportunity to refine their knowledge of evidence-based practices in literacy, mathematics, and the core content areas for students with exceptionalities in grades PK-12 (for example peer-assisted learning strategies, self-regulated strategy instruction, etc.). Teacher candidates will select, implement, and evaluate the success of evidence-based practices through the collection and analysis of student data.","-","Yes"
"Econ Health and Welfare Prgm","-","ECON","246","Undergraduate","Analysis of consumer theory, firm theory and market failure within the context of health economics. Emphasis on the institutions involved in health care provision, labor markets for health care professionals and market structure and government regulation. Offered in fall. Prereq: ECON 102.","G3","Yes"
"Econ of Industrial Orgnization","-","ECON","375","Undergraduate","The study of (1) how enterprises function within a variety of market structures and (2) how well the outcomes fit the public interest. Specific topics include market share, barriers, concentration, vertical power, economies of scale, pricing behavior, mergers and efficiency. Offered in spring. Prereq: ECON 101 and 102.","G3","Yes"
"Econ of Sex, Drugs, & Religion","-","ECON","355","Undergraduate","This course applies consumer theory, firm theory, and market failure to the economics of social issues via the broad, and often controversial, topics of sex, drugs, and religion. Emphasis is placed on the current economic, political, and legal aspects of these issues and therefore specific topics may change depending on current events. Students will explore these topics and lessons via research articles published in academic journals and by research published by the top economic research organizations. Prerequisites: ECON 102 and MATH 101 or math placement beyond 101, MATH 130 or equivalent.","G3, Perspectives (P)","Yes"
"Econometrics","-","ECON","333","Undergraduate","The estimation and hypothesis-testing of economic models, principally using regression techniques. Topics include linear models, time series analysis and simultaneous equations models. The uses and limitations of these models for economic forecasting are examined with the aid of computers. Offered in spring. Prereq: ECON 101, 102 and either 231 or 332.","-","Yes"
"Economic Geography","-","GEOG","222","Undergraduate","Location of economic activities in different environmental settings. The growth of global economic interdependence. Economic growth and development strategies in a regional framework. Economic versus environmental trade-offs. Offered in summer.","G3","No"
"Economic Growth and Develpmnt","-","ECON","326","Undergraduate","Introduction to economic characteristics and problems of less developed countries and to associated theories and policies. Offered annually. Prereq: ECON 101, 102; ENGL 110.","G3","Yes"
"Economics in Film","-","ECON","305","Undergraduate","This course utilizes film as a bridge between real economic life and scholarly treatment of the relevant issues. The course emphasizes critical thinking and synthesis of economic ideas. Students must also engage in questioning the obvious, exploring meaning, and writing about issues from films incisively and analytically following the scientific method. While maintaining rigor in their writing, students must state clearly their hypothesis and empirical methodology. Data collection includes prilnary data, surveys, personal interviews, and focus groups (culturally diverse groups related to the underlying socioeconomic issue). Prereq: ECON 100 or 101 or 102; COMM 100; ENGL 110 and junior status.","Writing (W), Diversity (D)","Yes"
"Economics of Justice","-","BUSN","310","Undergraduate","Economic concepts and models used to explain legal principles. The effects of legal decision-making on economic efficiency. Topics include property, contracts, torts and criminal law. Offered annually. Prereq: BUSN 202, ECON 102, COMM 100, ENGL 110, junior status.","Perspectives (P), Diversity (D)","Yes"
"Economics of Justice","-","ECON","310","Undergraduate","Economic concepts and models are used to explain laws and legal situations. Economics is applied in some of the principal areas of the law: property, contracts, torts and crime. Offered infrequently. Prereq: ENGL 110, COMM 100, junior status, ECON 102, BUSN 202, or permission of instructor.","Perspectives (P)","Yes"
"Ecosystems","-","BIOL","446","Undergraduate","Ecosystem processes including nutrient cycles, energy budgets and trophodynamics are discussed for terrestrial, coastal and marine ecosystems. Processes are discussed for ecosystem types such as those controlled by fire, volcanism, chemosynthetic bacteria, detrital food resources, herbivory and predation. Ecosystems viewed in a global perspective to understand global carbon and nutrient cycles. 3 hrs. lec./discussion. Offered in spring of even years. Prereq: BIOL 343 and ENGL 110.","Writing (W)","Yes"
"Editing for Publication","-","WRIT","317","Undergraduate","Focuses on the role of the editor in publishing. Developing skills to improve copy for publication, designing content for websites and blogs as well as creating photographic, audio and video material for use on the web. Prereq: ENGL 110 or equivalent","G1, Writing (W)","Yes"
"-","-","EDSL","462","Undergraduate","Student Teaching and Seminar Students must satisfactorily complete student teaching in order to qualify for certification. Seminar sessions are required. Students in the dual certification elementary and ESL certification program must have one experience in an elementary classroom and one experience in an ESL classroom. Prereq: admission to Advanced Professional Studies.","-","No"
"EDTE Stu Teaching","-","EDTE","462","Undergraduate","-","-","Yes"
"Edte Stu Teaching","-","EDTE","461","Undergraduate","Student teachers are assigned full-time to selected mentors in the Lancaster area. They are supervised by University faculty and gain experience in the responsibilities of the teacher. Prereq: EDTE 391 with a C or higher and EDTE 496. Co-requisites: EDTE 491 and SEED 471.","-","Yes"
"Education and Public Policy","-","EDFN","604","Graduate","An analysis of public policy development in the field of education. Major questions to explore include: (1) Who governs education? (2) What are the processes by which policies are formulated? (3) What values are reflected in specific present policy or proposed reform? (4) What do we know about reforming education? (5) How useful is social science research in the formulation of educational policy? Offered annually.","-","No"
"Education Foundations Liability","-","EDFN","212","Undergraduate","This course serves as a companion to EDFN 241. Students will understand the importance of and obtain the mandatory liability insurance associated with field placement experiences.","-","Yes"
"Educational Statistics","-","EDLD","831","Graduate","Designed to enable the student to interpret the scientific literature in education and psychology and to make the computations involved in the use of tests and original investigations that require statistical technique. Measure of central tendency, variability and correlations are included as are knowledge of and evaluation of effect size research related to instructional practices, leadership practices, and educational policy.","-","No"
"Eff Instr for Stdnts w Disabil","-","SPED","442","Undergraduate","This course is designed to prepare teacher candidates to provide effective instruction to children with mild disabilities. The course will focus on developing skills for high-quality instruction based on research-based practices used to design and adapt curriculum to provide high-quality, standard-based instruction for students with mild disabilities, with an emphasis on the inclusive classroom. Course participants will learn to plan, implement and assess the results of effective instruction aligned with students academic, social, emotional and behavioral needs to facilitate academic achievement, with an emphasis in development of literacy skills for students in need of supports in general education. Prereq: Act 34, 151, 114 clearances; admission to Advanced Professional Studies; Professional Bloc I courses of ECPK 421, SPED 321, SPED 341. Coreq: Strand II: SPED 412, SPED 452, SPED 453, SPED 454. Offered in fall, spring.","-","Yes"
"Effective Decision-Support for Space Weather Risks","-","SWEN","673","Graduate","Space weather data, products, and information Is a vital component for effective decision-making process for relevant stakeholders. This course uses a case-studies approach to Identify and document the most effective means of producing and delivering space-weather information including alerts, warnings, and notifications to target audiences and the general public, and to ensure that space-weather products are used intelligibly to inform decision making. Prerequisites: SWEN 572 or permission of program coordinator. 3 hrs. Fully online, distance-learning format. Offered annually.","-","Yes"
"Effective Teaching: Theories and Methods in Nurse Ed","-","NURS","630","Graduate","Educational theories and methods are explored in this course. The advantages and challenges of technology-based teaching and learning are presented. Past and future trends in education are discussed. Theory and research findings about the learning process, the nature of the learner and the goals of instruction are discussed.","-","No"
"Electromagnetic Fields 1","-","PHYS","321","Undergraduate","Electrostatic and magnetic fields in vacuum and in dielectric and magnetic materials. Maxwells equations are developed. 3 hrs. lec. Prereq: PHYS 232. Coreq: MATH 365.","-","Yes"
"Electromagnetic Fields 2","-","PHYS","322","Undergraduate","Consequences of Maxwells equations. Solutions to Laplaces equation, electromagnetic radiation and relativistic electrodynamics are discussed. 3 hrs. lec. Offered in fall. Prereq: PHYS 321. Coreq: PHYS 335.","-","Yes"
"Electronic Systems","-","AENG","261","Undergraduate","Survey of electricity and electronics, including typical direct current and alternating current applications, safe practices and technological impacts. Experiences include breadboarding, design and problem solving, use of test equipment and electronic project assembly/troubleshooting. 2 hrs. lec., 3 hrs. lab.","-","No"
"Electronics","-","PHYS","266","Undergraduate","The fundamentals of analog devices and their application to electronic circuits. Operational amplifiers, power supplies, semi-conductor devices, oscillators, and an introduction to integrated circuits. One 4-hour Lecture and Lab per week. Prereq: PHYS 132 or 232. Coreq: MATH 161. Offered in spring.","-","Yes"
"Eled Stu Teaching","-","EDEL","461","Undergraduate","Eled Stu Teaching","-","No"
"Eled Stu Teaching","-","EDEL","462","Undergraduate","Students must satisfactorily complete student teaching in order to qualify for certification. Seminar sessions are required. Students in the dual certification elementary and special education program must have one experience in an elementary classroom and one experience in a special education classroom. Offered in fall, spring.","-","No"
"Elem Stu Tch:  Art","-","EDAR","461","Undergraduate","Elementary and secondary student teaching placements in art education. Offered fall, spring. Should be combined with SEED 471. Prereq: Art 221, 322, 325.","-","Yes"
"Elem/Sec Math Connections","-","MATH","613","Graduate","This course is designed for graduate level students and will be of particular interest to practicing mathematics teachers of grades 7-12. In this course, we will explore the foundational concepts of the K-6 mathematics curriculum in significant depth while reflecting on ways to build strong connections between this elementary content and the content in the 7-12 curriculum. The goal is for students to see where their own teaching fits in the broader scheme of K-12 mathematics education so that they can design instruction that builds on their own students' prior understanding and contributes to a more holistic development for mid-level, middle, and high school mathematics learners. Course assignments may involve presentations, discussions, reading, written exams, papers, problem solving, problem posing, and instructional design.","-","No"
"Elementary  Japanese 2","-","JAPN","102","Undergraduate","Continuation of JAPN 101; emphasis on more complex syntactical structures while working toward greater proficiency in both productive (speaking and writing) and receptive (reading and listening) skills. Prereq: JAPN 101 or equivalent.","G1","Yes"
"Elementary Differential Geometry","-","MATH","457","Undergraduate","Frenet frames; curvature and torsion of curves in 3-space. Calculus of vector fields; geodesics and curvature of surfaces in 3-space. Surface area and volume. The Euler characteristic of a surface and the Gauss-Bonnet theorem. Rigid motions and isometries. Riemannian metrics, parallelism, non-Euclidean geometries and applications. Offered periodically. Prereq: C- or higher in MATH 310, 311, 322.","-","Yes"
"Elementary Japanese 1","-","JAPN","101","Undergraduate","Introduction to language and culture. Fundamentals of grammar and syntax. Oral practice, short readings and practice in aural comprehension. Emphasis on learning useful everyday phrases and working toward accuracy in pronunciation. Offered infrequently.","G1","No"
"Elementary Spanish 1","-","SPAN","101","Undergraduate","Introduction to language and culture. Fundamentals of grammar and syntax. Oral and written practice, short readings and practice in aural comprehension. Emphasis is placed on learning useful everyday phrases and working toward accuracy in pronunciation.","G1","No"
"Elementary Spanish 2","-","SPAN","102","Undergraduate","Continuation of SPAN 101; emphasis on more complex syntactical structures while working toward greater proficiency in both productive (speaking and writing) and receptive (reading and listening) skills. Prereq: SPAN 101 or 2 years of high school Spanish.","G1","Yes"
"Elements of Physics","-","PHYS","103","Undergraduate","An elementary treatment of fundamental concepts of classical and modern physics. Selected examples from classical mechanics, electromagnetism, thermodynamics, relativity and quantum mechanics. The solving of numerical problems is de-emphasized. 3 hrs. lec., 2 hrs. lab. No credit in block G2 for majors in the following departments: Biology, Chemistry, Computer Science, Earth Science, Math or Physics. Credit will be granted for only one of the courses: PHYS 101, 103 or 104. Offered in fall, periodically in spring.","G2, Lab (L)","No"
"Elements of Statistics 1","-","MATH","130","Undergraduate","Derivation of basic formulas; measures of central tendency and variability; probability and normal curve; sampling and hypothesis testing; confidence intervals. No credit toward a math or four-year computer science major, or under block G2 for majors in the School of Science and Mathematics except for nursing majors and allied health technology majors. Prereq: any 100-level MATH course or math placement testing/evaluation before registration. MATH 234 and MATH 235 are equivalent courses, credit will not be given for MATH 130, 234 and/or 235.","G2","Yes"
"Elements of Statistics 2","-","MATH","236","Undergraduate","An extension of MATH 130 or MATH 235. Includes estimation, hypothesis testing, design of experiments with analysis of variance, regression analysis, covariance analysis and nonparametric approaches. Includes experiences using a variety of computing devices. A substantial methods course for any major who needs to use statistical techniques. No credit toward math major. Offered in spring. Prereq: MATH 130 or MATH 235.","G2","Yes"
"ELPP 856: Facilities and Technology Leadership (3 credits) No pre or co requisites","-","EDLD","856","Graduate","EDLD 856: Facilities and Technology Leadership (3 credits) No pre or co requisites
In this course, students will develop, monitor, evaluate, and manage data-informed and equitable district systems for operations, resources, technology, and human capital management. These aspects will be further examined through Follett/Drucker leadership theory along with a focus to poverty and technology (in alignment with existing MU leadership foci). This course includes 60 required internship hours.
","-","Yes"
"Emergency Management Planning","-","EHEM","319","Undergraduate","Provides students with an in-depth analysis of planning methodologies and constructs as well as pitfalls and limiting factors in the development and execution of emergency management plans at the strategic, operational and tactical levels. Pre-requisite EHEM 201","-","Yes"
"Emergency Management Planning","-","EMGT","619","Graduate","In-depth analysis of planning methodologies and constructs as well as pitfalls and limiting factors in the development and execution of emergency management plans at the strategic, operational and tactical levels. Origins of emergency management planning, applicable policies and legislation, historical incident review and analysis, contemporary and emerging planning doctrine, and advanced planning concepts.","-","Yes"
"Emergency Mental Health and Trauma","-","EMGT","607","Graduate","This in-depth course provides the emergency responder with a greater appreciation of the challenges, responses and adjustments encountered by those exposed to disastrous events. Offered in spring.","-","Yes"
"Emergency Mental Health and Trauma","-","SOWK","607","Graduate","Provides an in-depth study of the concepts, policies, practices and research in crisis intervention during disasters. This course will provide an introduction to the disaster field, a detailed examination of the human service delivery systems and guidelines for attending to the emotional and mental-health needs of both disaster survivors and responders, using the Critical Incident Stress Management model. This course is offered online. Prereq: SOWK 601 or SOWK 531 or permission of instructor. Offered periodically.","-","Yes"
"Emergency Preparedness for Industry","-","EMGT","615","Graduate","An examination of industrial and societal risks associated with the manufacture, handling, storing and transporting of biological, chemical, nuclear and radiological materials. Offered in spring.","-","Yes"
"Emernt Tech & Instruc Practice","-","EDLD","828","Graduate","Designed to provide future school and district administrators with the requisite skill sets and conceptual knowledge needed for effective 21st century leadership. Understanding technology as a tool for learning, managing, analyzing, communicating and collaborating is integral to successful school leadership at the classroom, building and central office levels. Topics explored include technology integration, digital citizenship, use of technology in systematic organizational improvement, professional growth, digital culture and visionary leadership. In addition to developing personal philosophies regarding use of technology in teaching, learning, and leading, each student will develop a personal portfolio of resources.","-","No"
"Encounters in Human Diversity","-","SOWK","350","Undergraduate","An upper-level, multicultural, interdisciplinary, interactive course designed to enhance students knowledge, skills and values relative to working with people in professional situations within a diversity-embracing atmosphere. Focuses on the various differences in communication styles brought about by gender and culture. Designed for students whose anticipated careers are primarily oriented to direct work with people. Prereq: COMM 100, ENGL 110 and junior status.","Perspectives (P), Diversity (D)","Yes"
"Endocrinology","-","BIOL","437","Undergraduate","The role of hormones in the integration and control of physiological and developmental process is stressed as well as the molecular mechanism of hormone action. 3 hrs. lec. Offered in fall. Prereq: BIOL 362 or BIOL 263.","-","Yes"
"Energy and Power Systems","-","AENG","120","Undergraduate","An introduction to energy and power systems. Principles of conventional and alternative energy resources and energy conseNation, and electrical, fluid, and mechanical power will be studied along with environmental concerns associated with power production. 2 hours lecture, 3 hours lab.","-","No"
"Energy Sustainability","-","GEOG","305","Undergraduate","Explores energy production and consumption from geographic and sustainability perspectives. The social, economic and environmental impacts of traditional and alternative energy resources will be examined. Options for a sustainable energy future in different geographic locations will be addressed. Offered periodically. Prereq: ENGL 110; GEOG 101 or GEOG 202 or permission of instructor.","G3, Writing (W)","Yes"
"Energy, Sustainability ","-","AENG","304","Undergraduate","A non-technical course for all students dealing with energy sustainability, energy resources and conservation, and the effects of energy use on our environment. This course contains up-to-date information on essential subjects such as solar energy, wind energy, nuclear energy and energy conservation. Contemporary alternatives such as photovoltaic electricity and wind power generation will be addressed. Individual transportation to field sites is required (discuss with instructor before registering for class if this is an issue). Prereq: COMM 100, ENGL 110, MATH 100 or higher and Junior class standing.","Perspectives (P)","Yes"
"Eng Lit in the Early 17th Cent","-","ENGL","606","Graduate","Major English works, with attention to prose style, forms and style in verse; political events and developments in religious thought; intellectual climate of period 1600-1660. Offered biennially.","-","No"
